Astronomy & Cosmology,Biographies & Memoirs,Biology & Life Sciences,Business & Productivity,Childhood,Children's Literature,Classics,Climate & Environment,Computer Science,Contemporary & Literary Fiction,Engineering & Physics,Fantasy,Finance & Investing,Food & Cookbooks,Health & Fitness,Historical Fiction,History & Politics,Horror,LGBTQ+ Fiction,Language & Education,Language Learning,Magical Realism,Medicine & Neuroscience,Mystery & Thriller,Philosophical Fiction,Philosophy & Thought,Psychology & Self-Help,Religion & Spirituality,Romance,Science Fiction,Social Justice & Activism,Travel & Adventure,True Crime,Uncategorized,Young Adult
Big Bang: The Origin of the Universe,Raising Hare: A Memoir,The Botany of Desire: A Plant's-Eye View of the World,Principles: Life and Work,The Authoritative Calvin and Hobbes: A Calvin and Hobbes Treasury,"Scientific Progress Goes ""Boink"" (Calvin and Hobbes, #6)",Anthem,Ocean: Earths Last Wilderness,Remembering the Kanji II: A Systematic Guide to Reading Japanese Characters (Remembering the Japanese Characters Series),"Backlands (Kerney Family, #2)",Thing Explainer: Complicated Stuff in Simple Words,American Gods,The Essays of Warren Buffett : Lessons for Corporate America,"The Moosewood Cookbook: Recipes from Moosewood Restaurant, Ithaca, New York",Training for the Uphill Athlete: A Manual for Mountain Runners and Ski Mountaineers,The Last Ranch (Kerney Family #3),The Marines Take Anbar: The Four Year Fight Against al Qaeda (Leatherneck Classics),Salems Lot,Confessions of a Mask,Japanese Hiragana & Katakana for Beginners: First Steps to Mastering the Japanese Writing System,Remembering the Kanji III: Writing and Reading Japanese Characters for Upper-Level Proficiency,One hundred years of solitude,The Emperor of All Maladies: A Biography of Cancer,"The Secret of Secrets (Robert Langdon, #6)",Sophies World,Doing Good Better: How Effective Altruism Can Help You Make a Difference,We Can Do Hard Things: Answers to Life's 20 Questions,The Soul of Rumi: A New Collection of Ecstatic Poems,Bride,"The Three-Body Problem (Remembrance of Earths Past, #1)","The Hate U Give (The Hate U Give, #1)",Run or Die,American Kingpin: The Epic Hunt for the Criminal Mastermind Behind the Silk Road,A Gentleman in Moscow,Battle Royale
Fermat's Enigma,Memoirs of Hadrian,An Immense World: How Animal Senses Reveal the Hidden Realms Around Us,Japanese From Zero! 4: Proven Techniques to Learn Japanese for Students and Professionals (Japanese Edition),,Fantastic Mr. Fox,The Legend of Sleepy Hollow,Confessions of an Eco-Sinner: Tracking Down the Sources of My Stuff,The C Programming Language,Sucker Punch: Essays,Physics,"Wind and Truth (The Stormlight Archive, #5)",The Millionaire Next Door: The Surprising Secrets of America's Wealthy,Barefoot Contessa Family Style: Easy Ideas and Recipes That Make Everyone Feel Like Family,Fixing Your Feet: Injury Prevention and Treatment for Athletes,"Hard Country (Kerney Family, #1)",Who Is Government?: The Untold Story of Public Service,"The Gunslinger (The Dark Tower, #1)","Cleavage: Men, Women, and the Space Between Us",,,Life of Pi,Spark: The Revolutionary New Science of Exercise and the Brain,"Origin (Robert Langdon, #5)",Kokoro,Musashi's Book of Five Rings: The Definitive Interpertation of Miyomoto Musashi's Classic Book of Strategy,Hardest Geezer: Mind over Miles,Inner Dimensions of Islamic Worship,"The Notebook (The Notebook, #1)",The Martian,Men Who Hate Women,Born to run,Under the Banner of Heaven: A Story of Violent Faith,,The Absolutely True Diary of a Part-Time Indian
What If?: Serious Scientific Answers to Absurd Hypothetical Questions,Ghost in the Wires: My Adventures as the World's Most Wanted Hacker,"Scale: The Universal Laws of Growth, Innovation, Sustainability, and the Pace of Life in Organisms, Cities, Economies, and Companies",Japanese From Zero! 3: Proven Techniques to Learn Japanese for Students and Professionals,,The Twits,A Faint Heart,,The Code Book: The Science of Secrecy from Ancient Egypt to Quantum Cryptography,Dream Count,Six Easy Pieces: Essentials of Physics Explained by Its Most Brilliant Teacher,The Sunlit Man,Adaptive Markets: Financial Evolution at the Speed of Thought,Essentials of Classic Italian Cooking,The Ultimate Guide to Body Recomposition,The Book Thief,Amusing Ourselves to Death: Public Discourse in the Age of Show Business,Pet Sematary,The Song of Achilles,,,The Forty Rules of Love,Women in White Coats: How the First Women Doctors Changed the World of Medicine,"The Lost Symbol (Robert Langdon, #3)",The Temple of the Golden Pavilion,"Fallen Leaves: Last Words on Life, Love, War, and God",Read This If You Want to Take Great Photographs,Ihya Ulum Id Din,"It Ends with Us (It Ends with Us, #1)",Project Hail Mary,Wordslut: A Feminist Guide to Taking Back the English Language,Above the Clouds: How I Carved My Own Path to the Top of the World,Framed: Astonishing True Stories of Wrongful Convictions,,I Want to Eat Your Pancreas
Bad Astronomy,Kitchen Confidential: Adventures in the Culinary Underbelly,Complexity: The Emerging Science at the Edge of Order and Chaos,Japanese from Zero! 2: Proven Techniques to Learn Japanese for Students and Professionals (Japanese Edition),,,Dead Souls,,The Friendly Orange Glow: The Untold Story of the PLATO System and the Dawn of Cyberculture,Broken Country,,"Rhythm of War (The Stormlight Archive, #4)",Inside the Investor's Brain: The Power of Mind Over Money,Mastering the Art of French Cooking,The Rise of the Ultra Runners: A Journey to the Edge of Human Endurance,Three Kingdoms (4-Volume Boxed Set),The Earth Transformed: An Untold History,Carrie,,,,The Alchemist,"Blood: The Science, Medicine, and Mythology of Menstruation","Inferno (Robert Langdon, #4)",In Praise of Shadows,The Story of Philosophy: The Lives and Opinions of the World's Greatest Philosophers,"David and Goliath: Underdogs, Misfits, and the Art of Battling Giants",Al-Ghazali's Path to Sufism: His Deliverance from Error (al-Munqidh min al-Dalal),"Fifty Shades Freed (Fifty Shades, #3)",Planet of the Apes,White Tears/Brown Scars: How White Feminism Betrays Women of Color,The Race that Changed Running: The Inside Story of UTMB,The Tiger: A True Story of Vengeance and Survival,,"Pagan's Crusade (Pagan Chronicles, #1)"
Cosmos: Possible Worlds,Bad Blood: Secrets and Lies in a Silicon Valley Startup,Everything Is Tuberculosis: The History and Persistence of Our Deadliest Infection,Japanese from Zero! 1: Proven Techniques to Learn Japanese for Students and Professionals,,,The Sorrows of Young Werther,,Command-Line Rust: A Project-Based Primer for Writing Rust CLIs,Table for Two,,"Dawnshard (The Stormlight Archive, #3.5)",The Intelligent Investor,The Fannie Farmer Cookbook,Ultramarathon Man: Confessions of an All-Night Runner,Red Sorghum,The Dawn of Everything: A New History of Humanity,Misery,,,,,All in Her Head: The Truth and Lies Early Medicine Taught Us About Women's Bodies and Why It Matters Today,"Salvation of a Saint (Detective Galileo, #2)",Fight Club,The Pleasures of Philosophy,Remembering the Kanji I: A Complete Course on How Not to Forget the Meaning and Writing of Japanese Characters,"Purification of the Heart: Signs, Symptoms and Cures of the Spiritual Diseases of the Heart","Fifty Shades Darker (Fifty Shades, #2)",Dark Matter,Invisible Women: Data Bias in a World Designed for Men,Plays With Cars,In Cold Blood,,"There's Treasure Everywhere (Calvin and Hobbes, #10)"
The Pope of Physics: Enrico Fermi and the Birth of the Atomic Age,The Moment of Lift: How Empowering Women Changes the World,The What If 100 Book: The Most Popular Hypothetical Scenarios Explained With Science,How to Win at College: Surprising Secrets for Success from the Country's Top Students,,,A Clockwork Orange,,Where Wizards Stay Up Late: The Origins of the Internet,The Cry of the Dove,,"Oathbringer (The Stormlight Archive, #3)",The Richest Man in Babylon,The New Basics Cookbook,"Finding Ultra: Rejecting Middle Age, Becoming One of the World's Fittest Men, and Discovering Myself",Night,The WEIRDest People in the World: How the West Became Psychologically Peculiar and Particularly Prosperous,The Stand,,,,,Protocols: An Operating Manual for the Human Body,"The Devotion of Suspect X (Detective Galileo, #1)",Silence,What's Wrong with the World,The Life-Changing Magic of Tidying Up: The Japanese Art of Decluttering and Organizing,Tafsir Ibn Kathir Volume 10 0f 10,"Fifty Shades of Grey (Fifty Shades, #1)","Sandworms of Dune (Dune, #8)",The Unseen Truth: When Race Changed Sight in America,"Three Men in a Boat (Three Men, #1)",And the Sea Will Tell,,The Calvin and Hobbes Tenth Anniversary Book
"The Elegant Universe: Superstrings, Hidden Dimensions, and the Quest for the Ultimate Theory","Be Water, My Friend: The Teachings of Bruce Lee","What If? 2: Additional Serious Scientific Answers to Absurd Hypothetical Questions (What If?, #2)",Working in Public: The Making and Maintenance of Open Source Software,,,Eugene Onegin,,Design Patterns: Elements of Reusable Object-Oriented Software,The Things They Carried,,"Edgedancer (The Stormlight Archive, #2.5)",The Psychology of Money,The Joy of Cooking,It's Not Hysteria: Everything You Need to Know About Your Reproductive Health (But Were Never Told),Mottled Dawn: Fifty Sketches and Stories of Partition,"Japan in Transformation, 1945-2010 (Seminar Studies)",It,,,,,Avicenna Canon of Medicine Complete Five Volume Set,Marathon Man,The Metamorphosis,"The Masnavi, Book Two",Make Time: How to Focus on What Matters Every Day,Tafsir Ibn Kathir Volume 9 0f 10,,"Hunters of Dune (Dune, #7)",Just Mercy,Trail of the Lost: The Relentless Search to Bring Home the Missing Hikers of the Pacific Crest Trail,,,"Homicidal Psycho Jungle Cat (Calvin and Hobbes, #9)"
Shadows of Forgotten Ancestors,In Order to Live: A North Korean Girl's Journey to Freedom,"Why Fish Dont Exist: A Story of Loss, Love, and the Hidden Order of Life",Originals: How Non-Conformists Move the World,,,Demons,,HTML and CSS: Design and Build Websites,How to Read Literature Like a Professor,,"Words of Radiance (The Stormlight Archive, #2)",,,Never Finished,Three Wild Dogs and the Truth,The Rape of Nanking: The Forgotten Holocaust of World War II,11/22/63,,,,,Your Brain On Porn: Internet Pornography and the Emerging Science of Addiction,We Have Always Lived in the Castle,Collected Stories,The Masnavi: Book One,"Goodbye, Things: The New Japanese Minimalism",Tafsir Ibn Kathir Volume 8 0f 10,,Chapterhouse: Dune (Dune #6),,"Eat, Pray, Love",,,"The Days Are Just Packed (Calvin and Hobbes, #8)"
Broca's Brain: Reflections on the Romance of Science,Permanent Record,Lifespan: Why We Ageand Why We Don't Have To,Fashionopolis: The Price of Fast Fashion and the Future of Clothes,,,Selected Poetry,,Artificial Intelligence: A Guide for Thinking Humans,"Fifth Business (The Deptford Trilogy, #1)",,"The Way of Kings (The Stormlight Archive, #1)",,,Ultra-Processed People: The Science Behind Food That Isn't Food,The Women,Forward: Notes on the Future of Our Democracy,You Like It Darker,,,,,Behave: The Biology of Humans at Our Best and Worst,Five Decembers,   ,The Abolition of Man,The Defining Decade: Why Your Twenties MatterAnd How to Make the Most of Them Now,Tafsir Ibn Kathir Volume 7 0f 10,,Heretics of Dune (Dune #5),,,,,"Attack of the Deranged Mutant Killer Monster Snow Goons (Calvin and Hobbes, #7)"
The Varieties of Scientific Experience: A Personal View of the Search for God,"iWoz: Computer Geek to Cult Icon: How I Invented the Personal Computer, Co-Founded Apple, and Had Fun Doing It",The Selfish Gene,"Creativity, Inc.: Overcoming the Unseen Forces That Stand in the Way of True Inspiration",,,The Age of Innocence,,Hello World: Being Human in the Age of Algorithms,Star of the North,,"A Dream of Spring (A Song of Ice and Fire, #7)",,,Racing Weight: How to Get Lean for Peak Performance,All the Light We Cannot See,"The Hundred Years War on Palestine: A History of Settler-Colonial Conquest and Resistance, 19172017","Doctor Sleep (The Shining, #2)",,,,,"The Molecule of More: How a Single Chemical in Your Brain Drives Love, Sex, and Creativityand Will Determine the Fate of the Human Race",The Inmate,   ,The Palliative Society: Pain Today,The Scout Mindset: Why Some People See Things Clearly and Others Don't,Tafsir Ibn Kathir Volume 6 0f 10,,God Emperor of Dune (Dune #4),,,,,The Indispensable Calvin and Hobbes
Billions & Billions: Thoughts on Life and Death at the Brink of the Millennium,"The Spirit Catches You and You Fall Down: A Hmong Child, Her American Doctors, and the Collision of Two Cultures",The Dragons of Eden: Speculations on the Evolution of Human Intelligence,Pour Your Heart Into It: How Starbucks Built a Company One Cup at a Time,,,White Nights,,PHP & MySQL: Server-side Web Development,The Lincoln Highway,,"The Winds of Winter (A Song of Ice and Fire, #6)",,,Breath: The New Science of a Lost Art,The Nightingale,How to Hide an Empire: A History of the Greater United States,"The Shining (The Shining, #1)",,,,,Why We Sleep: Unlocking the Power of Sleep and Dreams,"The Perfect Marriage (Perfect, #1)", ,The Unabomber Manifesto: Industrial Society and Its Future,The Monk Who Sold His Ferrari: A Fable About Fulfilling Your Dreams and Reaching Your Destiny,Tafsir Ibn Kathir Volume 5 0f 10,,Children of Dune (Dune #3),,,,,"The Revenge of the Baby-Sat (Calvin and Hobbes, #5)"
Pale Blue Dot: A Vision of the Human Future in Space,"Sigh, Gone: A Misfit's Memoir of Great Books, Punk Rock, and the Fight to Fit In",,Subprime Attention Crisis (FSG Originals x Logic),,,Stopping By Woods on a Snowy Evening,,JavaScript and jQuery: Interactive Front-End Web Development,The Travelling Cat Chronicles,,"A Dance with Dragons (A Song of Ice and Fire, #5)",,,"Born to Run, Eat and Run, Running with the Kenyans 3 Books Collection Set","The Tattooist of Auschwitz (The Tattooist of Auschwitz, #1)",Material World: The Six Raw Materials That Shape Modern Civilization,The Strange Case of Dr. Jekyll and Mr. Hyde and Other Tales of Terror,,,,,When Breath Becomes Air,Never Lie,The Book of Love: Poems of Ecstasy and Longing,Philosophical Investigations,TED Talks: The Official TED Guide to Public Speaking,Tafsir Ibn Kathir Volume 4 0f 10,,Dune Messiah (Dune #2),,,,,"Weirdos from Another Planet! (Calvin and Hobbes, #4)"
The Demon-Haunted World: Science as a Candle in the Dark,"Hatching Twitter: A True Story of Money, Power, Friendship, and Betrayal",,Traction: A Startup Guide to Getting Customers,,,The Overcoat,,"Chess: 5334 Problems, Combinations and Games",Uncanny Valley,,"A Feast for Crows (A Song of Ice and Fire, #4)",,,Eat & Run: My Unlikely Journey to Ultramarathon Greatness,The Boy in the Striped Pajamas,The White Man's Burden: Why the West's Efforts to Aid the Rest Have Done So Much Ill and So Little Good,The Witches,,,,,,Behind Closed Doors,The Masnavi: Book Three,Phenomenology of Perception,The Rational Male,Tafsir Ibn Kathir Volume 3 0f 10,,"The Hitchhikers Guide to the Galaxy (Hitchhiker's Guide to the Galaxy, #1)",,,,,"Yukon Ho! (Calvin and Hobbes, #3)"
Contact,Becoming Steve Jobs: The Evolution of a Reckless Upstart into a Visionary Leader,,Predictable Revenue,,,"God Sees the Truth, but Waits",,Code: The Hidden Language of Computer Hardware and Software,"Tales from the Caf (Before the Coffee Gets Cold, #2)",,"A Storm of Swords (A Song of Ice and Fire, #3)",,,,Water for Elephants,The End of Poverty: Economic Possibilities for Our Time,Dracula,,,,,,Pretty Girls,The Last Messiah,Patterns Of Culture,Cognitive Behavior Therapy: Basics and Beyond,Tafsir Ibn Kathir Volume 2 0f 10,,Fahrenheit 451,,,,,Something Under the Bed Is Drooling
Cosmos,Born a Crime: Stories From a South African Childhood,,"The Upstarts: How Uber, Airbnb, and the Killer Companies of the New Silicon Valley Are Changing the World",,,A Midsummer Nights Dream,,Invent Your Own Computer Games With Python,Flowers for Algernon,,"A Clash of Kings  (A Song of Ice and Fire, #2)",,,,The Kite Runner,Poor Economics: A Radical Rethinking of the Way to Fight Global Poverty,Frankenstein: The 1818 Text,,,,,,The Woman in White,On the Heights of Despair,Discipline and Punish: The Birth of the Prison,Low Tech Life: A Guide to Mindful Digital Minimalism,Tafsir Ibn Kathir Volume 1 0f 10,,"Dune (Dune, #1)",,,,,"Calvin and Hobbes (Calvin and Hobbes, #1)"
Astrophysics for People in a Hurry,Wild Swans: Three Daughters of China,,The Cold Start Problem: How to Start and Scale Network Effects,,,Macbeth,,"Python Crash Course: A Hands-On, Project-Based Introduction to Programming",After Dark,,"A Game of Thrones (A Song of Ice and Fire, #1)",,,,A Thousand Splendid Suns,Shakespeare's Sisters: How Women Wrote the Renaissance,The Invisible Man,,,,,,The Girl on the Train,"How to Tell When We Will Die: On Pain, Disability, and Doom",On the Genealogy of Morals,Scarcity Brain: Fix Your Craving Mindset and Rewire Your Habits to Thrive with Enough,The Purpose of Life,,,,,,,"Crooked Kingdom (Six of Crows, #2)"
A Brief History of Time,Vincent and Theo: The Van Gogh Brothers,,Blitzscaling: The Lightning-Fast Path to Building Massively Valuable Companies,,,Hamlet,,"Generative Deep Learning: Teaching Machines to Paint, Write, Compose, and Play",Kafka on the Shore,,"A Court of Silver Flames (A Court of Thorns and Roses, #4)",,,,Pachinko,Women in the Valley of the Kings: The Untold Story of Women Egyptologists in the Gilded Age,"The Haunted Car (Goosebumps Series 2000, #21)",,,,,,The DaVinci Code: A Quest for Answers,Erotism: Death and Sensuality,The Gay Science: With a Prelude in Rhymes and an Appendix of Songs,How to Not Die Alone: The Surprising Science That Will Help You Find Love,Baal-e-Jibreel,,,,,,,Where the Sidewalk Ends: Poems and Drawings
,What I Talk About When I Talk About Running,,"Endure: How to Work Hard, Outlast, and Keep Hammering",,,Romeo and Juliet,,"Machine Learning Design Patterns: Solutions to Common Challenges in Data Preparation, Model Building, and MLOps",Novelist as a Vocation,,The Magic Shop,,,,Musashi,"Rousseau and Revolution (The Story of Civilization, #10)",,,,,,,And Then There Were None,"Zen and the Art of Motorcycle Maintenance: An Inquiry Into Values (Phaedrus, #1)",Spinoza: Practical Philosophy,Who Moved My Cheese? An Amazing Way to Deal with Change in Your Work and in Your Life...,Shikwa and Jawab-i-Shikwa: Iqbal's Dialogue with Allah,,,,,,,"Crank Palace (The Maze Runner, #3.5)"
,Billion Dollar Loser: The Epic Rise and Spectacular Fall of Adam Neumann and WeWork,,Extreme Ownership: How U.S. Navy SEALs Lead and Win,,,The Dream of a Ridiculous Man,,Deep Learning for Coders with Fastai and Pytorch: AI Applications Without a PhD,"Tuesdays with Morrie: An Old Man, a Young Man, and Life's Greatest Lesson",,"The Lion, the Witch and the Wardrobe (Chronicles of Narnia, #1)",,,,"Unbroken: A World War II Story of Survival, Resilience and Redemption","The Age of Napoleon (The Story of Civilization, #11)",,,,,,,Brighton Rock,Atlas Shrugged,Ethics,"The Secret (The Secret, #1)",Mazhab aur science,,,,,,,"The Death Cure (The Maze Runner, #3)"
,The Nvidia Way: Jensen Huang and the Making of a Tech Giant,,The Millionaire Fastlane: Crack the Code to Wealth and Live Rich for a Lifetime!,,,The Christmas Tree and the Wedding,,Designing Data-Intensive Applications,The Princess Bride,,Alices Adventures in Wonderland / Through the Looking-Glass,,,,Roxana,"The Renaissance (The Story of Civilization, #5)",,,,,,,"The Case-Book of Sherlock Holmes (Sherlock Holmes, #9)",The Extinction of Experience: Being Human in a Disembodied World,De Anima (On the Soul),The 7 Habits of Highly Effective People,Divine Speech,,,,,,,"The Scorch Trials (The Maze Runner, #2)"
,Alibaba: The House That Jack Ma Built,,Source Code: My Beginnings,,,Poor People and A Little Hero,,Designing Machine Learning Systems: An Iterative Process for Production-Ready Applications,A Man Called Ove,,"Bilbo's Last Song (Middle Earth, #4.5)",,,,The Underground Railroad,"The Age of Faith (The Story of Civilization, #4)",,,,,,,"His Last Bow (Sherlock Holmes, #8)",Blindness,The Art of Rhetoric,Real Superpowers That Will Change Your Life,Secrets of Divine Love: A Spiritual Journey into the Heart of Islam,,,,,,,"The Maze Runner (The Maze Runner, #1)"
,Between Two Kingdoms: A Memoir of a Life Interrupted,,The Idea Factory: Bell Labs and the Great Age of American Innovation,,,Howards End,,Deep Learning with Python,What You Are Looking For Is in the Library,,"The Return of the King (The Lord of the Rings, #3)",,,,North and South,Story of Civilization,,,,,,,"The Valley of Fear (Sherlock Holmes, #7)",Gravitys Rainbow,Poetics,The Good Mother Myth: Unlearning Our Bad Ideas About How to Be a Good Mom,,,,,,,,"The Giver (The Giver, #1)"
,The Dressmakers of Auschwitz: The True Story of the Women Who Sewed to Survive,,"Delay, Deny, Defend: Why Insurance Companies Don't Pay Claims and What You Can Do About It",,,The Old Man and the Sea,,LLM Engineer's Handbook: Master the art of engineering large language models from concept to production,Earthlings,,"The Two Towers (The Lord of the Rings, #2)",,,,Rebecca,"Caesar and Christ (Story of Civilization, #3)",,,,,,,"The Return of Sherlock Holmes (Sherlock Holmes, #6)",Maldoror and the Complete Works,Metaphysics,How To: Absurd Scientific Advice for Common Real-World Problems,,,,,,,,"Holes (Holes, #1)"
,Butts: A Backstory,,The Almanack of Naval Ravikant: A Guide to Wealth and Happiness,,,Northanger Abbey,,Hands-On Machine Learning with Scikit-Learn and TensorFlow,Almond,,"The Fellowship of the Ring (The Lord of the Rings, #1)",,,,Around the World in Eighty Days,"The Life of Greece (The Story of Civilization, #2)",,,,,,,"The Hound of the Baskervilles (Sherlock Holmes, #5)",Letter to His Father,The Marx-Engels Reader,How to Do Nothing: Resisting the Attention Economy,,,,,,,,Paper Towns
,Code Name: Lise: The True Story of the Woman Who Became WWII's Most Highly Decorated Spy,,The Pragmatic Programmer: From Journeyman to Master,,,Lady Susan,,Data Science from Scratch: First Principles with Python,The Sailor Who Fell from Grace with the Sea,,"The Hobbit, or There and Back Again",,,,A Journal of the Plague Year,The Greatest Minds and Ideas of All Time,,,,,,,"The Memoirs of Sherlock Holmes (Sherlock Holmes, #4)",Zaboor-e-Ajam,Nonsense on Stilts: How to Tell Science from Bunk,Models: Attract Women Through Honesty,,,,,,,,Looking for Alaska
,The Elements of Marie Curie: How the Glow of Radium Lit a Path for Women in Science,,The Unicorn Project,,,Sense and Sensibility,,Python for Data Analysis,Daughters of Shandong,,"Harry Potter and the Cursed Child: Parts One and Two (Harry Potter, #8)",,,,"Little Women (Little Women, #1)","Our Oriental Heritage (The Story of Civilization, #1)",,,,,,,"The Adventures of Sherlock Holmes (Sherlock Holmes, #3)",Javed Nama (Urdu) /  ,The Society of the Spectacle,Four Thousand Weeks: Time Management for Mortals,,,,,,,,The Outsiders
,Jane Austen's Bookshelf: A Rare Book Collector's Quest to Find the Women Writers Who Shaped a Legend,,"The Phoenix Project: A Novel About IT, DevOps, and Helping Your Business Win",,,Persuasion,,Algorithms to Live By: The Computer Science of Human Decisions,In the Miso Soup,,"Harry Potter and the Deathly Hallows (Harry Potter, #7)",,,,Moll Flanders,The Lessons of History,,,,,,,"The Sign of Four (Sherlock Holmes, #2)",No Longer Human,My System: A Treatise on Chess (Tartan Books),Psycho-Cybernetics: A New Way to Get More Living Out of Life,,,,,,,,"A Court of Frost and Starlight (A Court of Thorns and Roses, #3.5)"
,Propaganda Girls: The Secret War of the Women in the OSS,,The One Thing: The Surprisingly Simple Truth Behind Extraordinary Results,,,Middlemarch,,Introduction to Algorithms,I Heard the Owl Call My Name,,"Harry Potter and the Prisoner of Azkaban (Harry Potter, #3)",,,,Gone with the Wind,Freedom At Midnight,,,,,,,"A Study in Scarlet (Sherlock Holmes, #1)",The Judgement (Short Story),The Alchemy of Happiness,"The Masculine in Relationship: A Blueprint for Inspiring the Trust, Lust, and Devotion of a Strong Woman",,,,,,,,"A Court of Wings and Ruin (A Court of Thorns and Roses, #3)"
,The Dream Machine: J.C.R. Licklider and the Revolution That Made Computing Personal,,Soft Skills: The Software Developer's Life Manual,,,Tess of the DUrbervilles,,A Thousand Brains: A New Theory of Intelligence,On the Road,,"Harry Potter and the Chamber of Secrets (Harry Potter, #2)",,,,Civil War Stories,Jinnah of Pakistan,,,,,,,"The Talented Mr. Ripley (Ripley, #1)",The Great Wall of China,  ,"Take Command: Find Your Inner Strength, Build Enduring Relationships, and Live the Life You Want (Dale Carnegie Books)",,,,,,,,"A Court of Mist and Fury (A Court of Thorns and Roses, #2)"
,The Man from the Future: The Visionary Ideas of John von Neumann,,Essentialism: The Disciplined Pursuit of Less,,,The Scarlet Letter,,Practical Statistics for Data Scientists: 50 Essential Concepts,Ethan Frome,,"Harry Potter and the Sorcerers Stone (Harry Potter, #1)",,,,The Prince and the Pauper,The JFK Conspiracy: The Secret Plot to Kill Kennedyand Why It Failed,,,,,,,"Angels & Demons (Robert Langdon, #1)",Three Questions,Mutluluun Kazanlmas (Tahsilu's-Sa'ada),"Firestarters: How Innovators, Instigators, and Initiators Can Inspire You to Ignite Your Own Life",,,,,,,,"A Court of Thorns and Roses (A Court of Thorns and Roses, #1)"
,A Mind at Play: How Claude Shannon Invented the Information Age,,"How Life Imitates Chess: Making the Right Moves, from the Board to the Boardroom",,,The Iliad,,"The Rust Programming Language, 2nd Edition",The Awakening,,James and the Giant Peach,,,,A Tale of Two Cities,Cobalt Red: How the Blood of the Congo Powers Our Lives,,,,,,,"The da Vinci Code (Robert Langdon, #2)",The Razors Edge,    ,The Uni-Verse: The Ultimate Guide to Surviving University,,,,,,,,The Fault in Our Stars
